question,correct_answer,possible_answers,type
Who was the screenwriter for Arizona?,Douglas Fairbanks,"[""Douglas Fairbanks"", ""Douglas Fairbanks, Sr."", ""Douglas Elton Thomas Ullman"", ""Douglas Ullman"", ""Doug Fairbanks"", ""Albert Parker""]",screenwriter
Who was the director of Passion?,Brian De Palma,"[""Brian De Palma"", ""Brian Russell De Palma""]",director
What is the capital of Kingdom of Italy?,Florence,"[""Florence"", ""Firenze"", ""Florence, Italy"", ""Florence, Tuscany"", ""Florencia"", ""Florentia"", ""Florenz"", ""Firenca"", ""Florencie"", ""Fiuränza"", ""Florentzia"", ""Firense"", ""Firenz"", ""Firenzi"", ""Rome"", ""The Eternal City"", ""Roma"", ""Rome Italy"", ""Turin"", ""Torino"", ""Turin, Italy""]",capital
Who was the director of Camp?,Andy Warhol,"[""Andy Warhol"", ""Andrew Warhola"", ""Andrew Warhol"", ""Drella"", ""Andrej Varchol"", ""Andrej Warhol""]",director
What is the capital of Schleswig-Holstein?,Kiel,"[""Kiel""]",capital
Who was the producer of The Homesman?,Tommy Lee Jones,"[""Tommy Lee Jones"", ""Thomas Lee Jones""]",producer
Who was the director of Small Time?,Shane Meadows,"[""Shane Meadows""]",director
What is the capital of Worth County?,Sylvester,"[""Sylvester"", ""Sylvester, Georgia""]",capital
Who was the screenwriter for Stereo?,David Cronenberg,"[""David Cronenberg"", ""David Paul Cronenberg"", ""David P. Cronenberg"", ""David Cronenburg""]",screenwriter
In what country is Mount Cleveland?,United States of America,"[""United States of America"", ""the United States of America"", ""America"", ""U.S.A."", ""USA"", ""U.S."", ""US"", ""the US"", ""the USA"", ""US of A"", ""the United States"", ""U. S. A."", ""U. S."", ""the States"", ""the U.S."", ""'Merica"", ""U.S"", ""United States"", ""'Murica""]",country
Who is the father of Carl Grimes?,Rick Grimes,"[""Rick Grimes""]",father
What genre is Women?,art rock,"[""art rock""]",genre
What is the religion of Spring Arbor University?,Free Methodist Church,"[""Free Methodist Church""]",religion
Who was the screenwriter for Love?,Roscoe Arbuckle,"[""Roscoe Arbuckle"", ""Fatty Arbuckle"", ""Roscoe Conkling Arbuckle"", ""William Goodrich""]",screenwriter
What is the religion of Peter I?,Lutheranism,"[""Lutheranism"", ""Lutheran Church"", ""Lutherans""]",religion
Who was the screenwriter for Wish You Were Here?,David Leland,"[""David Leland""]",screenwriter
Who was the producer of Anonymous?,John Orloff,"[""John Orloff"", ""Roland Emmerich""]",producer
Who was the producer of Primary?,Robert Drew,"[""Robert Drew"", ""Robert Lincoln Drew""]",producer
What is the religion of Bellino Giusto Ghirard?,Catholic Church,"[""Catholic Church"", ""Roman Catholic Church"", ""Church"", ""Roman Apostolic Catholic Church""]",religion
Who was the director of The Lovers?,Tsui Hark,"[""Tsui Hark""]",director
Who was the producer of Vitti Dandu?,Ajay Devgn,"[""Ajay Devgn"", ""Vishal Devgan"", ""Ajay Devgan""]",producer
What genre is Insight?,anthology series,"[""anthology series""]",genre
Who was the producer of Trade?,Roland Emmerich,"[""Roland Emmerich""]",producer
What color is Juventus F.C.?,white,"[""white"", ""W"", ""color white"", ""#FFFFFF""]",color
What is Yoshiki Tonogai's occupation?,mangaka,"[""mangaka"", ""manga artist""]",occupation
Who was the screenwriter for From the Terrace?,Ernest Lehman,"[""Ernest Lehman"", ""Ernest Paul Lehman"", ""John O'Hara"", ""John Henry O'Hara""]",screenwriter
Who was the director of Stretch?,Joe Carnahan,"[""Joe Carnahan"", ""Joseph Aaron \""Joe\"" Carnahan"", ""Joseph Aaron Carnahan""]",director
Who was the composer of The Host?,Lee Byung-woo,"[""Lee Byung-woo"", ""Lee Byeong-u"", ""Lee Byeong-woo""]",composer
Who is the author of Gospel of Matthew?,Matthew the Apostle,"[""Matthew the Apostle"", ""Saint Matthew"", ""Matthew"", ""Matthew the Evangelist""]",author
"Who is the father of William de Mandeville, 3rd Earl of Essex?","Geoffrey de Mandeville, 1st Earl of Essex","[""Geoffrey de Mandeville, 1st Earl of Essex""]",father
"Who is the father of Johann VII, Duke of Mecklenburg?","John Albert I, Duke of Mecklenburg","[""John Albert I, Duke of Mecklenburg"", ""Johann Albrecht I Herzog von Mecklenburg""]",father
Who was the composer of Something?,George Harrison,"[""George Harrison"", ""The Quiet Beatle"", ""Nelson Wilbury"", ""00013482508 IPI""]",composer
Who was the screenwriter for Good News?,Betty Comden,"[""Betty Comden"", ""Basya Cohen""]",screenwriter
Who was the producer of Breaking Point?,Bob Clark,"[""Bob Clark"", ""Benjamin \""Bob\"" Clark"", ""Benjamin Robert Clark""]",producer
Who was the producer of Trash?,Andy Warhol,"[""Andy Warhol"", ""Andrew Warhola"", ""Andrew Warhol"", ""Drella"", ""Andrej Varchol"", ""Andrej Warhol""]",producer
In what city was David Harris Willson born?,Philadelphia,"[""Philadelphia"", ""Philly"", ""City of Brotherly Love"", ""Cradle of Liberty"", ""Philadelphia, Pennsylvania"", ""City of Philadelphia"", ""Philadelphia, PA""]",place of birth
Who was the screenwriter for Quitting?,Zhang Yang,"[""Zhang Yang"", ""Yang Zhang""]",screenwriter
Who was the director of Green Hell?,James Whale,"[""James Whale""]",director
In what city was Xue Fei born?,Beijing,"[""Beijing"", ""Peking"", ""Beiping"", ""Peiping"", ""Yanjing"", ""Zhongdu"", ""Khanbaliq"", ""BJ"", ""Shun Tian Fu"", ""Pekin""]",place of birth
Who was the screenwriter for Tape?,Stephen Belber,"[""Stephen Belber""]",screenwriter
Who is the author of Off the Road?,Carolyn Cassady,"[""Carolyn Cassady"", ""Carolyn Elizabeth Robinson Cassady""]",author
Who is the author of Hagarism?,Patricia Crone,"[""Patricia Crone"", ""Michael Cook"", ""Michael Allan Cook""]",author
Who was the producer of Clue?,Debra Hill,"[""Debra Hill"", ""John Landis""]",producer
Who was the producer of One Way?,Til Schweiger,"[""Til Schweiger"", ""Tilman Valentin Schweiger""]",producer
Who was the screenwriter for Rising?,Brad Wright,"[""Brad Wright""]",screenwriter
Who was the director of The Fool?,Christine Edzard,"[""Christine Edzard""]",director
Who was the producer of April?,Nanni Moretti,"[""Nanni Moretti"", ""Giovanni \""Nanni\"" Moretti"", ""Giovanni Moretti""]",producer
Who is the father of Michael VII Doukas?,Konstantinos X Doukas,"[""Konstantinos X Doukas"", ""Constantine X Ducas, Emperor of Constantinople""]",father
What sport does Mario Rigamonti play?,association football,"[""association football"", ""football"", ""soccer""]",sport
Who was the producer of Mast?,Ram Gopal Varma,"[""Ram Gopal Varma"", ""RGV"", ""Penmetsa Ram Gopal Varma""]",producer
Who is the author of Alice?,Judith Hermann,"[""Judith Hermann""]",author
Who was the director of Busted?,Corey Feldman,"[""Corey Feldman""]",director
Who was the producer of Daddy?,Allu Aravind,"[""Allu Aravind""]",producer
Who is the author of The Rising?,Tim LaHaye,"[""Tim LaHaye"", ""Timothy LaHaye"", ""Timothy F. \""Tim\"" LaHaye"", ""Timothy Francis LaHaye"", ""Tim Francis LaHaye""]",author
In what city was Edgar Manas born?,Istanbul,"[""Istanbul"", ""İstanbul""]",place of birth
What is Karen Redman's occupation?,politician,"[""politician"", ""political leader"", ""political figure"", ""polit."", ""pol""]",occupation
In what country is Lima?,United States of America,"[""United States of America"", ""the United States of America"", ""America"", ""U.S.A."", ""USA"", ""U.S."", ""US"", ""the US"", ""the USA"", ""US of A"", ""the United States"", ""U. S. A."", ""U. S."", ""the States"", ""the U.S."", ""'Merica"", ""U.S"", ""United States"", ""'Murica""]",country
In what city was John Johnson born?,LaGrange,"[""LaGrange"", ""LaGrange, Georgia"", ""La Grange""]",place of birth
Who was the director of Camera?,David Cronenberg,"[""David Cronenberg"", ""David Paul Cronenberg"", ""David P. Cronenberg"", ""David Cronenburg""]",director
Who is the author of The Economics and Ethics of Private Property?,Hans-Hermann Hoppe,"[""Hans-Hermann Hoppe""]",author
Who was the composer of Remember the Time?,Michael Jackson,"[""Michael Jackson"", ""MJ"", ""The King of Pop"", ""Michael Joe Jackson"", ""Michael Joseph Jackson"", ""M.J."", ""M. J."", ""King of Pop"", ""King of Music"", ""The King""]",composer
Who was the producer of The Bay?,Barry Levinson,"[""Barry Levinson""]",producer
What sport does Vasili Penyasov play?,association football,"[""association football"", ""football"", ""soccer""]",sport
In what city was Hank Autry born?,Hattiesburg,"[""Hattiesburg"", ""Hattiesburg, Mississippi""]",place of birth
What genre is Arise?,death metal,"[""death metal"", ""thrash metal"", ""trash metal"", ""thrash"", ""Best early thrash metal""]",genre
Who was the director of Out of Control?,Dominic Savage,"[""Dominic Savage""]",director
Who was the producer of LOL?,Joe Swanberg,"[""Joe Swanberg"", ""Joseph Swanberg""]",producer
Who was the screenwriter for The Fever?,Wallace Shawn,"[""Wallace Shawn"", ""Wallace Michael Shawn"", ""Wally Shawn""]",screenwriter
What genre is The Fly?,horror film,"[""horror film"", ""horror movie"", ""science fiction film"", ""sci-fi film"", ""science fiction movie"", ""sci-fi movie"", ""scifi film"", ""scifi movie"", ""sci fi film"", ""sci fi movie"", ""scifi-film"", ""scifi""]",genre
Who is the father of Mwanga II of Buganda?,Muteesa I,"[""Muteesa I"", ""Muteesa I Mukaabya Walugembe Kayiira""]",father
What is Boutheina Jabnoun's occupation?,journalist,"[""journalist"", ""journo"", ""journalists""]",occupation
Who was the screenwriter for Genesis: The Creation and the Flood?,Ermanno Olmi,"[""Ermanno Olmi""]",screenwriter
What genre is Convicted?,film noir,"[""film noir""]",genre
Who is the author of Hope?,Mark Clapham,"[""Mark Clapham"", ""Mark  Clapham""]",author
Who was the producer of Grounds for Marriage?,Samuel Marx,"[""Samuel Marx""]",producer
Who is the author of Mute?,Stephen King,"[""Stephen King"", ""Stephen Edwin King"", ""Richard Bachman"", ""John Swithen""]",author
Who was the composer of Trans?,Karlheinz Stockhausen,"[""Karlheinz Stockhausen"", ""Karl-Heinz Stockhausen""]",composer
Who is the author of Relic?,Douglas Preston,"[""Douglas Preston"", ""Douglas Jerome Preston"", ""Douglas J. Preston"", ""Lincoln Child""]",author
Who is the author of Empire and Communications?,Harold Innis,"[""Harold Innis"", ""Harold Adams Innis""]",author
Who was the composer of Fat Girl?,Pierluigi Balducci,"[""Pierluigi Balducci""]",composer
Who was the screenwriter for Legion?,Rob Grant,"[""Rob Grant"", ""Robert Grant""]",screenwriter
What genre is Beautiful Garbage?,alternative rock,"[""alternative rock"", ""alternative music"", ""alt-rock"", ""alternative"", ""alt rock"", ""pop/rock""]",genre
What is the religion of Roman Republic?,ancient Roman religion,"[""ancient Roman religion"", ""Roman religion"", ""Religio Romana"", ""Roman polytheism"", ""ancient Roman polytheism""]",religion
Who was the producer of Marc?,Muriel Young,"[""Muriel Young""]",producer
What is the capital of Nord?,Lille,"[""Lille"", ""Rijsel"", ""Lile"", ""Rysel""]",capital
Who was the screenwriter for Love Letter?,Shunji Iwai,"[""Shunji Iwai"", ""Iwai Shunji""]",screenwriter
Who was the screenwriter for Love Love Love?,Brad Falchuk,"[""Brad Falchuk"", ""Bradley Douglas Falchuk""]",screenwriter
Who is the father of Sybilla of Normandy?,Henry I of England,"[""Henry I of England"", ""Henry Beauclerc"", ""Henry I"", ""King Henry I of England""]",father
What is the capital of Andorra?,Andorra la Vella,"[""Andorra la Vella""]",capital
What is the religion of Bede?,Christianity,"[""Christianity"", ""Christian faith""]",religion
Who was the screenwriter for The Walk?,Robert Zemeckis,"[""Robert Zemeckis"", ""Robert L. Zemeckis"", ""Robert Lee Zemeckis""]",screenwriter
Who is the father of Aslaug?,Sigurd,"[""Sigurd"", ""Siegfried"", ""Sigfrido""]",father
Who was the screenwriter for Vithagan?,R. Parthiepan,"[""R. Parthiepan""]",screenwriter
Who was the screenwriter for La Piscine?,Jacques Deray,"[""Jacques Deray""]",screenwriter
In what country is Mas?,United States of America,"[""United States of America"", ""the United States of America"", ""America"", ""U.S.A."", ""USA"", ""U.S."", ""US"", ""the US"", ""the USA"", ""US of A"", ""the United States"", ""U. S. A."", ""U. S."", ""the States"", ""the U.S."", ""'Merica"", ""U.S"", ""United States"", ""'Murica""]",country
What is Prague the capital of?,Central Bohemian Region,"[""Central Bohemian Region"", ""Středočeský kraj"", ""Central Bohemia"", ""Central Bohemia Region"", ""Czech Socialist Republic"", ""Czech SR"", ""Česká socialistická republika"", ""Czech Republic"", ""CZR"", ""cz"", ""Česko"", ""Česká republika"", ""ČR"", ""cze"", ""Czechia"", ""Czechoslovakia"", ""Czecho-Slovakia"", ""cs"", ""TCH"", ""Československo"", ""ČSFR"", ""Federation of Czechoslovakia"", ""People's Republic of Czechoslovakia"", ""CSFR"", ""Bohemia"", ""Kingdom of Bohemia"", ""České království"", ""Königreich Böhmen"", ""Regnum Bohemiae"", ""Czech Kingdom""]",capital of
What is the capital of Malawi?,Lilongwe,"[""Lilongwe""]",capital
"Who was the composer of Robinson Crusoe, Jr.?",Sigmund Romberg,"[""Sigmund Romberg"", ""Siegmund Rosenberg""]",composer
Who was the producer of I Will Follow?,Ava DuVernay,"[""Ava DuVernay"", ""Ava Marie DuVernay""]",producer
Who was the producer of Avatar?,James Cameron,"[""James Cameron"", ""James Francis Cameron"", ""Jim Cameron""]",producer
Who was the composer of Nancy?,Jimmy Van Heusen,"[""Jimmy Van Heusen"", ""James Van Heusen"", ""Edward Chester Babcock"", ""Arthur Williams""]",composer
What is the religion of Appalachian Bible College?,Baptists,"[""Baptists"", ""Baptist church"", ""Baptist""]",religion
Who was the director of The Fast and the Furious?,Rob Cohen,"[""Rob Cohen"", ""Robert Cohen""]",director
Who was the director of End of the Line?,Jay Russell,"[""Jay Russell""]",director
Who was the director of My Wife?,Tinto Brass,"[""Tinto Brass"", ""Mauro Bolognini"", ""Luigi Comencini""]",director
What is the capital of Bulgaria?,Sofia,"[""Sofia"", ""Serdica"", ""Sredez"", ""Sofija"", ""Sredets""]",capital
What is Galina Starovoytova's occupation?,politician,"[""politician"", ""political leader"", ""political figure"", ""polit."", ""pol""]",occupation
Who was the director of The Runner?,Amir Naderi,"[""Amir Naderi""]",director
What genre is North?,comedy film,"[""comedy film"", ""comedy movie""]",genre
Who was the producer of Aadmi Aur Aurat?,Doordarshan,"[""Doordarshan"", ""DD""]",producer
Who was the director of The King and I?,Walter Lang,"[""Walter Lang""]",director
Who was the director of Action?,John Ford,"[""John Ford"", ""Jack Ford"", ""John Martin Feeney""]",director
Who was the director of Sunshine State?,John Sayles,"[""John Sayles"", ""John Thomas Sayles""]",director
What genre is Back to the Future?,comedy film,"[""comedy film"", ""comedy movie"", ""science fiction film"", ""sci-fi film"", ""science fiction movie"", ""sci-fi movie"", ""scifi film"", ""scifi movie"", ""sci fi film"", ""sci fi movie"", ""scifi-film"", ""scifi""]",genre
Who was the screenwriter for The River?,Jean Renoir,"[""Jean Renoir""]",screenwriter
What is Brussels Capital Region the capital of?,Burgundian Netherlands,"[""Burgundian Netherlands"", ""Western European Union"", ""European Economic Community"", ""EEC"", ""Common Market"", ""European Community"", ""Spanish Netherlands"", ""Austrian Netherlands""]",capital of
What genre is In Your Eyes?,romance film,"[""romance film"", ""romance genre"", ""romantic film""]",genre
Who is the father of Mithridates I of Parthia?,Phriapatius of Parthia,"[""Phriapatius of Parthia"", ""Phriapatius""]",father
In what city was Cornelis Springer born?,Amsterdam,"[""Amsterdam"", ""Mokum"", ""Amsterdam, NL"", ""Amsterdam, Netherlands"", ""A'dam""]",place of birth
Who was the composer of Orange?,Harris Jayaraj,"[""Harris Jayaraj""]",composer
What is the capital of Swedish Pomerania?,Szczecin,"[""Szczecin"", ""Stettin"", ""Stralsund""]",capital
In what city was Zsuzsanna Németh born?,Budapest,"[""Budapest"", ""Buda Pest"", ""Buda-Pest"", ""Budapešť"", ""Budapesta"", ""Budapeszt"", ""Buda"", ""Ofen"", ""Budín"", ""Budim"", ""Budon"", ""Pest"", ""Pešť"", ""Pešta"", ""Óbuda"", ""Alt-Ofen"", ""Kőbánya""]",place of birth
In what country is Medveščak?,Croatia,"[""Croatia"", ""Republic of Croatia"", ""HR"", ""HRV"", ""🇭🇷"", ""CRO""]",country
What is Bobby Henon's occupation?,politician,"[""politician"", ""political leader"", ""political figure"", ""polit."", ""pol""]",occupation
"Who was the screenwriter for Féminin, masculin?",Kiarash Anvari,"[""Kiarash Anvari""]",screenwriter
Who was the screenwriter for By the Sea?,Angelina Jolie,"[""Angelina Jolie"", ""Angelina Jolie Voight""]",screenwriter
In what city was Ted Williams born?,San Diego,"[""San Diego"", ""San Diego, California"", ""SD"", ""America's Finest City"", ""Sandi"", ""the birthplace of California""]",place of birth
Who was the producer of The Lost Children?,Disturbed,"[""Disturbed""]",producer
What is the capital of Wa State?,Pangkham,"[""Pangkham""]",capital
Who is the author of Exposure?,Mal Peet,"[""Mal Peet"", ""Malcolm Charles Peet""]",author
Who is the father of Malcolm Munthe?,Axel Munthe,"[""Axel Munthe""]",father
What is Rich Brightman's occupation?,singer-songwriter,"[""singer-songwriter"", ""singer songwriter"", ""singer/songwriter"", ""singersongwriter""]",occupation
What genre is Love Story?,romance film,"[""romance film"", ""romance genre"", ""romantic film"", ""film adaptation"", ""based upon"", ""adapted for the screen"", ""cinematic adaptation""]",genre
In what country is Francis?,Canada,"[""Canada"", ""Dominion of Canada"", ""British North America"", ""CAN"", ""CA"", ""Can.""]",country
Who is the author of The Whole Family?,Henry James,"[""Henry James"", ""Henricus James"", ""Alice Brown"", ""William Dean Howells"", ""William Howells"", ""Elizabeth Jordan"", ""Elizabeth Garver Jordan""]",author
What sport does 1990–91 British Basketball League season play?,basketball,"[""basketball"", ""hoops"", ""b-ball"", ""basket ball"", ""BB""]",sport
Who is the author of Crow?,Ted Hughes,"[""Ted Hughes"", ""Edward James Hughes""]",author
What is Felicia Chateloin's occupation?,architect,"[""architect""]",occupation
In what city was Léon-Lévy Brunswick born?,Paris,"[""Paris"", ""City of Light"", ""Paris, France""]",place of birth
Who was the producer of Saw II?,Gregg Hoffman,"[""Gregg Hoffman"", ""Oren Koules"", ""Mark Burg"", ""Leigh Whannell""]",producer
What genre is Dinosaur?,adventure film,"[""adventure film"", ""adventure movie"", ""adventure""]",genre
Who was the screenwriter for Oil?,Ben Elton,"[""Ben Elton"", ""Benjamin Charles Elton"", ""Rik Mayall"", ""Richard Michael Mayall"", ""Lise Mayer""]",screenwriter
Who was the screenwriter for The Intern?,Nancy Meyers,"[""Nancy Meyers"", ""Nancy Jane Meyers""]",screenwriter
"Who was the composer of Suddenly, Last Summer?",Buxton Orr,"[""Buxton Orr"", ""Malcolm Arnold"", ""Sir Malcolm Henry Arnold"", ""Malcolm Henry Arnold"", ""Sir Malcolm Arnold""]",composer
Who was the director of The Score?,Frank Oz,"[""Frank Oz"", ""Richard Frank Oznowicz"", ""Richard Oznowicz""]",director
Who was the screenwriter for Apartment?,Jag Mundhra,"[""Jag Mundhra""]",screenwriter
Who was the producer of The Piano?,Jan Chapman,"[""Jan Chapman""]",producer
Who is the father of Bill Haas?,Jay Haas,"[""Jay Haas""]",father
In what country is Oxford?,United States of America,"[""United States of America"", ""the United States of America"", ""America"", ""U.S.A."", ""USA"", ""U.S."", ""US"", ""the US"", ""the USA"", ""US of A"", ""the United States"", ""U. S. A."", ""U. S."", ""the States"", ""the U.S."", ""'Merica"", ""U.S"", ""United States"", ""'Murica""]",country
What is Will Smith's occupation?,record producer,"[""record producer"", ""music producer"", ""film director"", ""movie director"", ""director"", ""motion picture director"", ""film producer"", ""movie producer"", ""producer"", ""actor"", ""actress"", ""actors"", ""actresses""]",occupation
Who was the composer of Live Your Life?,T.I.,"[""T.I."", ""T.I.P"", ""Clifford Joseph Harris Jr."", ""Tip"", ""Clifford Harris Jr."", ""Just Blaze"", ""Justin Smith"", ""Justin Gregory Smith""]",composer
Who was the composer of Every Night?,Paul McCartney,"[""Paul McCartney"", ""Sir Paul McCartney"", ""Macca"", ""James Paul McCartney""]",composer
What is the capital of Othón P. Blanco Municipality?,Chetumal,"[""Chetumal"", ""Chetumal, Quintana Roo"", ""Chetumel""]",capital
What genre is Relax?,trance,"[""trance"", ""trance music""]",genre
What is the capital of South Dakota?,Pierre,"[""Pierre"", ""Pierre, South Dakota"", ""Pierre, SD""]",capital
Who was the producer of Gorgeous?,Jackie Chan,"[""Jackie Chan"", ""Cheng Lung"", ""Sing Lung"", ""Y'uen Lo"", ""Pao Pao"", ""Kong-sang Chan"", ""Kung-Fu Master"", ""Yuan-Lou Chen"", ""Yuan Lung Chen"", ""Yuen Lung Chen"", ""Chen Yuan Lung"", ""Chen Yuen Lung"", ""Jacky Chan"", ""Chen Yuan-lung"", ""Lung Cheng"", ""Chen Lung"", ""Chan Kong-sang""]",producer
Who was the director of Heaven over the Marshes?,Augusto Genina,"[""Augusto Genina""]",director
Who was the screenwriter for The Greatest?,Shana Feste,"[""Shana Feste""]",screenwriter
In what country is Givron?,France,"[""France"", ""fr"", ""République française"", ""La France"", ""Republic of France"", ""French Republic"", ""FRA"", ""the Hexagon""]",country
What is the capital of Takamatsu Domain?,Takamatsu,"[""Takamatsu""]",capital
What genre is To Mother?,J-pop,"[""J-pop"", ""Japanese pop"", ""jpop""]",genre
Who was the director of The Alternate?,Sam Firstenberg,"[""Sam Firstenberg""]",director
What sport does earned run average play?,baseball,"[""baseball"", ""America's pastime"", ""⚾""]",sport
In what city was Jean Arp born?,Strasbourg,"[""Strasbourg"", ""Straßburg"", ""Strassburg"", ""Schdroosburi"", ""Strossburi"", ""Strossburig"", ""Strosburi""]",place of birth
Who was the screenwriter for Absentia?,Mike Flanagan,"[""Mike Flanagan""]",screenwriter
Who is the author of Les Vingt et un Jours d'un neurasthénique?,Octave Mirbeau,"[""Octave Mirbeau"", ""Mirbeau"", ""Octave Henri Marie Mirbeau""]",author
Who was the composer of Listen?,Anne Preven,"[""Anne Preven"", ""Henry Krieger"", ""Scott Cutler""]",composer
In what country is Goreme?,Bulgaria,"[""Bulgaria"", ""Republic of Bulgaria"", ""bg"", ""🇧🇬"", ""BUL"", ""BGR""]",country
What genre is You Are Free?,documentary film,"[""documentary film"", ""documentary movie"", ""doc"", ""film documentary"", ""motion picture documentary"", ""documentary"", ""factual film""]",genre
Who was the screenwriter for Thor?,Mark Protosevich,"[""Mark Protosevich"", ""Mark David Protosevich"", ""Ashley Miller"", ""Ashley Edward Miller"", ""Zack Stentz""]",screenwriter
Who was the composer of Phenomenon?,Thomas Newman,"[""Thomas Newman"", ""Thomas Montgomery Newman""]",composer
What is the religion of L. Ron Hubbard?,Scientology,"[""Scientology""]",religion
What genre is One Voice?,rhythm and blues,"[""rhythm and blues"", ""R&B"", ""RnB"", ""R and B"", ""R & B""]",genre
Who was the screenwriter for These Children?,Mario Mattoli,"[""Mario Mattoli""]",screenwriter
What is Chang'an the capital of?,Western Wei,"[""Western Wei"", ""Western Yan"", ""Former Qin"", ""Qian Qin"", ""Later Qin"", ""Xin dynasty"", ""Xin chao"", ""New dynasty"", ""Northern Zhou"", ""Bei Zhou"", ""Han dynasty"", ""Han Empire"", ""Han"", ""Han China"", ""Sui dynasty"", ""Tang Empire"", ""Tang China"", ""Tang"", ""Tang dynasty""]",capital of
Who was the producer of Man of the Year?,Barry Levinson,"[""Barry Levinson""]",producer
Who was the screenwriter for Pilot?,Brad Falchuk,"[""Brad Falchuk"", ""Bradley Douglas Falchuk"", ""Ian Brennan""]",screenwriter
Who was the producer of The Jolson Story?,Sidney Buchman,"[""Sidney Buchman"", ""Sidney R. Buchman"", ""Sidney Robert Buchman""]",producer
Who was the producer of For No One?,George Martin,"[""George Martin"", ""Sir George Henry Martin"", ""Sir George Martin""]",producer
Who is the author of Jack?,John Farnham,"[""John Farnham"", ""John Peter Farnham""]",author
Who was the director of The Interview?,Seth Rogen,"[""Seth Rogen"", ""Seth Aaron Rogen"", ""Evan Goldberg""]",director
What is the capital of Palestinian territories?,Jerusalem,"[""Jerusalem"", ""Yerushalayim"", ""J'lem"", ""Aelia Capitolina"", ""Al-Quds"", ""Jerusalem, Middle East""]",capital
Who was the director of The Creator?,Albert Dupontel,"[""Albert Dupontel""]",director
Who is the father of Arjun Sarja?,Shakti Prasad,"[""Shakti Prasad""]",father
Who was the director of Too Much (Little) Love?,Jacques Doillon,"[""Jacques Doillon""]",director
What is Claire Berlinski's occupation?,journalist,"[""journalist"", ""journo"", ""journalists""]",occupation
Who was the screenwriter for Eva?,Ingmar Bergman,"[""Ingmar Bergman"", ""Ernst Ingmar Bergman""]",screenwriter
What genre is Break Free?,comedy-drama,"[""comedy-drama"", ""dramedy"", ""comedic drama"", ""tragicomedy"", ""seriocomedy"", ""comedy drama"", ""dramatic comedy"", ""Comedy-drama, dramedy""]",genre
Who was the director of Guru?,Umesh Mehra,"[""Umesh Mehra""]",director
Who was the director of Leader?,Ram Mukherjee,"[""Ram Mukherjee""]",director
Who was the composer of La rondine?,Giacomo Puccini,"[""Giacomo Puccini"", ""Puccini"", ""Giacomo Antonio Domenico Michele Secondo Maria Puccini""]",composer
What genre is Remodeled?,reality television,"[""reality television"", ""reality TV"", ""reality television program"", ""reality TV program"", ""reality television show"", ""television reality program"", ""television reality show"", ""TV reality program"", ""TV reality show""]",genre
Who is the author of Rose?,Tomson Highway,"[""Tomson Highway""]",author
Who was the composer of The Relic?,John Debney,"[""John Debney"", ""John C. Debney"", ""John Cardon Debney""]",composer
