question,correct_answer,possible_answers,type
What is the capital of Khouribga Province?,Khouribga,"[""Khouribga""]",capital
Who was the composer of Ray?,Ray Charles,"[""Ray Charles"", ""Ray Charles Robinson"", ""Raymond Charles Robinson Peter""]",composer
Who was the screenwriter for Pilot?,Kevin Falls,"[""Kevin Falls""]",screenwriter
Who was the screenwriter for La Collectionneuse?,Patrick Bauchau,"[""Patrick Bauchau"", ""Patrick Nicolas Jean Sixte Ghislain Bauchau""]",screenwriter
In what country is National Youth?,Sweden,"[""Sweden"", ""Kingdom of Sweden"", ""SE"", ""SWE"", ""🇸🇪""]",country
What is Ruth Harriet Louise's occupation?,photographer,"[""photographer"", ""photog"", ""photographers""]",occupation
Who was the screenwriter for Close My Eyes?,Stephen Poliakoff,"[""Stephen Poliakoff""]",screenwriter
What sport does Alexis Carra play?,association football,"[""association football"", ""football"", ""soccer""]",sport
Who was the director of Geordie?,Frank Launder,"[""Frank Launder""]",director
Who was the director of Ready?,Anees Bazmee,"[""Anees Bazmee""]",director
Who was the director of Another Country?,Marek Kanievska,"[""Marek Kanievska""]",director
Who was the director of California?,John Farrow,"[""John Farrow"", ""John Villiers Farrow""]",director
What is the capital of Ukraine?,Kyiv,"[""Kyiv"", ""Kiev"", ""Kyjiv"", ""Kyyiv"", ""Kyjiw"", ""Kyiw"", ""Kyïv"", ""Kief"", ""Kieff"", ""Kiew"", ""Kioff"", ""Kiof"", ""Kiowia"", ""Kiovia"", ""Kiow"", ""Kiou"", ""Kyїv""]",capital
What is the capital of Neuburg-Schrobenhausen?,Neuburg an der Donau,"[""Neuburg an der Donau"", ""Neuburg/Donau"", ""Neuburg a.d.Donau""]",capital
Who was the director of Stonewall?,Roland Emmerich,"[""Roland Emmerich""]",director
Who was the producer of Australia?,Baz Luhrmann,"[""Baz Luhrmann"", ""Mark Anthony Luhrmann""]",producer
What is Rio de Janeiro the capital of?,State of Brazil,"[""State of Brazil"", ""Brazil"", ""Federative Republic of Brazil"", ""BR"", ""BRA"", ""🇧🇷"", ""Rio de Janeiro"", ""Rio de Janeiro state"", ""RJ"", ""Rio de Janeiro (state)""]",capital of
In what country is Mon?,Thailand,"[""Thailand"", ""Kingdom of Thailand"", ""th"", ""Siam"", ""🇹🇭"", ""Land of Smiles"", ""THA""]",country
Who was the screenwriter for Gamer?,Mark Neveldine,"[""Mark Neveldine""]",screenwriter
In what country is St. Martin's Cathedral?,Netherlands,"[""Netherlands"", ""Holland"", ""the Netherlands"", ""NL"", ""NED"", ""Nederland"", ""🇳🇱"", ""Netherlands (after 1945)""]",country
Who was the producer of Show Me?,Mustard,"[""Mustard"", ""Dijon Isaiah McFarlane"", ""Dijon McFarlane"", ""DJ Mustard""]",producer
Who was the director of Unknown?,Jaume Collet-Serra,"[""Jaume Collet-Serra"", ""Jaume Collet Serra""]",director
What is Conrad Weiser's occupation?,diplomat,"[""diplomat""]",occupation
Who was the screenwriter for Pilot?,Jed Whedon,"[""Jed Whedon"", ""Jed Tucker Whedon"", ""Maurissa Tancharoen"", ""Maurissa Tancharoen Whedon""]",screenwriter
What genre is V: The Original Miniseries?,science fiction television series,"[""science fiction television series"", ""science fiction TV"", ""science fiction series"", ""science fiction television"", ""science fiction on television""]",genre
Who is the author of Legs?,William Kennedy,"[""William Kennedy"", ""William Joseph Kennedy""]",author
What is Flying Fish Cove the capital of?,Christmas Island,"[""Christmas Island"", ""cx"", ""🇨🇽"", ""Christmas Island, Other Territories"", ""Christmas Island, Other Territories, Australia"", ""Territory of Christmas Island""]",capital of
Who was the producer of The Connection?,Shirley Clarke,"[""Shirley Clarke"", ""Shirley Brimberg Clarke"", ""Shirley Brimberg""]",producer
Who was the screenwriter for The Right Way?,Mark Penney,"[""Mark Penney""]",screenwriter
Who is the author of Back Home?,Michelle Magorian,"[""Michelle Magorian""]",author
Who was the screenwriter for Amor de Perdição?,Manoel de Oliveira,"[""Manoel de Oliveira"", ""Manoel Cândido Pinto de Oliveira""]",screenwriter
Who was the director of The Greatest?,Tom Gries,"[""Tom Gries"", ""Thomas Stephen Gries"", ""Monte Hellman"", ""Monte Jay Himmelman"", ""Monte Himmelbaum""]",director
What sport does King's Indian Defence play?,chess,"[""chess"", ""International Chess"", ""Modern European Chess"", ""Western Chess"", ""chess game""]",sport
Who was the screenwriter for Murderers?,Patrick Grandperret,"[""Patrick Grandperret""]",screenwriter
Who was the director of Hollywood?,James Cruze,"[""James Cruze""]",director
Who was the director of Partition?,Vic Sarin,"[""Vic Sarin""]",director
Who was the screenwriter for The Believer?,Henry Bean,"[""Henry Bean""]",screenwriter
What genre is Killjoy?,horror film,"[""horror film"", ""horror movie"", ""slasher film"", ""slasher movie"", ""slasher""]",genre
Who was the director of The Mask?,Chuck Russell,"[""Chuck Russell"", ""Charles Russell""]",director
What genre is Fear?,horror film,"[""horror film"", ""horror movie""]",genre
Who was the screenwriter for The Jacket?,Jerry Seinfeld,"[""Jerry Seinfeld"", ""Jerome Allen Seinfeld"", ""Cable Boy"", ""Mr. Steinfeld"", ""Jerome Allen \""Jerry\"" Seinfeld"", ""Larry David"", ""Lawrence Gene David"", ""Lawrence Gene \""Larry\"" David"", ""the greatest man alive""]",screenwriter
In what city was K. M. Beenamol born?,Kerala,"[""Kerala"", ""Keralam"", ""IN-KL"", ""God's Own Country"", ""Land of coconuts""]",place of birth
"Who was the composer of Nun komm, der Heiden Heiland, BWV 62?",Johann Sebastian Bach,"[""Johann Sebastian Bach"", ""Bach"", ""J.S. Bach"", ""J. S. Bach"", ""J S Bach""]",composer
Who was the screenwriter for Company Man?,Douglas McGrath,"[""Douglas McGrath"", ""Douglas Geoffrey McGrath""]",screenwriter
What is the religion of magi?,Zoroastrianism,"[""Zoroastrianism"", ""Zarathustraism"", ""Mazdaism"", ""Mazdanism"", ""Magianism"", ""The Good Religion"", ""Mazdayasna""]",religion
Who is the author of Success?,Jonathan Cape,"[""Jonathan Cape""]",author
Who was the screenwriter for The Department?,David Williamson,"[""David Williamson"", ""David Keith Williamson""]",screenwriter
Who is the author of The Third Round?,H. C. McNeile,"[""H. C. McNeile"", ""Herman Cyril McNeile"", ""Cyril McNeile"", ""Sapper""]",author
What is Hun the capital of?,Jufra,"[""Jufra"", ""Jofra""]",capital of
Who was the director of Drive?,Rob Bowman,"[""Rob Bowman"", ""Rob Stanton Bowman"", ""Rob S. Bowman""]",director
What is the capital of California?,Sacramento,"[""Sacramento"", ""Sac-Town"", ""Sac"", ""The Indomitable City"", ""City of Trees"", ""The Big Tomato"", ""The Capitol City"", ""Sacramento, California"", ""Camellia City"", ""River City""]",capital
In what country is Kuujjuarapik?,Canada,"[""Canada"", ""Dominion of Canada"", ""British North America"", ""CAN"", ""CA"", ""Can.""]",country
What is the capital of Emilia-Romagna?,Bologna,"[""Bologna"", ""Bologna, Italy""]",capital
Who is the father of Mary of Woodstock?,Edward I of England,"[""Edward I of England"", ""Edward Longshanks"", ""Hammer of the Scots"", ""König Eduard I. England"", ""re d'Inghilterra Edward I"", ""Hammer of the Scots Edward"", ""roi d'Angleterre Édouard I"", ""King of England Edward I"", ""Malleus Scotorum Edward"", ""Edward I"", ""Edward I Longshanks""]",father
Who was the director of Reno?,John Farrow,"[""John Farrow"", ""John Villiers Farrow""]",director
Who was the composer of Azure?,Duke Ellington,"[""Duke Ellington"", ""Edward Kennedy \""Duke\"" Ellington"", ""Edward Kennedy Ellington"", ""Edward K. Ellington""]",composer
In what city was Gaston-François de Witte born?,Antwerp,"[""Antwerp"", ""Antwerpen"", ""City of Antwerp"", ""Anvers""]",place of birth
Who was the director of 15 Maiden Lane?,Allan Dwan,"[""Allan Dwan""]",director
What genre is Mark Castillo?,metalcore,"[""metalcore"", ""metallic hardcore""]",genre
Who is the author of On Writing?,Stephen King,"[""Stephen King"", ""Stephen Edwin King"", ""Richard Bachman"", ""John Swithen""]",author
Who was the director of Three Wishes?,Martha Coolidge,"[""Martha Coolidge""]",director
What is the religion of Kingdom of England?,Catholic Church,"[""Catholic Church"", ""Roman Catholic Church"", ""Church"", ""Roman Apostolic Catholic Church""]",religion
What genre is Scorpio?,rock music,"[""rock music"", ""rock and roll"", ""rock""]",genre
Who was the producer of Room at the Top?,John and James Woolf,"[""John and James Woolf""]",producer
Who was the producer of New?,Mark Ronson,"[""Mark Ronson"", ""Mark Daniel Ronson"", ""DJ Ronson""]",producer
Who is the author of The Unicorn in the Garden?,James Thurber,"[""James Thurber"", ""James Grover Thurber""]",author
What is the capital of Guadeloupe?,Basse-Terre,"[""Basse-Terre""]",capital
What genre is Episode?,power metal,"[""power metal""]",genre
Who was the director of Alien?,Ridley Scott,"[""Ridley Scott"", ""Sir Ridley Scott""]",director
What genre is The Glory That Was?,science fiction,"[""science fiction"", ""SF"", ""scifi"", ""sci Fi"", ""sci-Fi"", ""science-fiction"", ""sciencefiction""]",genre
Who was the director of The First Time?,Yan Han,"[""Yan Han""]",director
In what city was Bruce Charles Heezen born?,Vinton,"[""Vinton"", ""Vinton, Iowa""]",place of birth
Who was the screenwriter for What Happened Was?,Tom Noonan,"[""Tom Noonan""]",screenwriter
What sport does Stephen Connor play?,association football,"[""association football"", ""football"", ""soccer""]",sport
In what city was Antoine Richard born?,Fontainebleau,"[""Fontainebleau"", ""Fontaine-la-Montagne"", ""Fontaine-le-Vallon""]",place of birth
Who was the director of Clerk?,Manoj Kumar,"[""Manoj Kumar""]",director
What is the religion of Northland International University?,Baptists,"[""Baptists"", ""Baptist church"", ""Baptist""]",religion
Who was the screenwriter for Airbag?,Juanma Bajo Ulloa,"[""Juanma Bajo Ulloa"", ""Juan Manuel Bajo Ulloa""]",screenwriter
Who was the composer of Separado!?,Gruff Rhys,"[""Gruff Rhys"", ""Gruffudd Maredudd Bowen Rhys""]",composer
Who was the producer of Look Around You?,Peter Serafinowicz,"[""Peter Serafinowicz"", ""Peter Szymon Serafinowicz"", ""Robert Popper"", ""Robert Darren Popper""]",producer
Who is the mother of Princess Maria Antonia of Naples and Sicily?,Maria Carolina of Austria,"[""Maria Carolina of Austria"", ""Queen consort of Ferdinand I Maria Carolina"", ""Queen, consort of Ferdinand I, King of the Two Sicilies Maria Carolina"", ""koningin van Napels Maria Carolina"", ""reine de Naples Marie-Caroline"", ""Queen of Naples Maria Carolina"", ""Maria Carolina d'Austria"", ""Archduchess Maria Karolina Luise Josepha Johanna Antonia"", ""Maria Karolina von Österreich"", ""S.M. la Reine de Naples""]",mother
Who was the director of Condorman?,Charles Jarrott,"[""Charles Jarrott""]",director
Who was the screenwriter for Boudu Saved from Drowning?,Jean Renoir,"[""Jean Renoir""]",screenwriter
Who was the producer of Hot Water?,Harold Lloyd,"[""Harold Lloyd"", ""Harold Clayton Lloyd"", ""Harold Clayton Lloyd, Sr.""]",producer
Who was the screenwriter for Slam?,Saul Williams,"[""Saul Williams"", ""Saul Stacey Williams""]",screenwriter
Who was the composer of Friends?,Elton John,"[""Elton John"", ""Reg Dwight"", ""Sir Elton Hercules John"", ""Reginald Kenneth Dwight""]",composer
What is the religion of Father Jean Bernard?,Catholic Church,"[""Catholic Church"", ""Roman Catholic Church"", ""Church"", ""Roman Apostolic Catholic Church""]",religion
What is Pierre the capital of?,South Dakota,"[""South Dakota"", ""SD"", ""South Dakota, United States"", ""State of South Dakota"", ""SoDak"", ""S. Dakota"", ""The Mount Rushmore State"", ""The Coyote State"", ""S. Dak."", ""S.D."", ""Hughes County"", ""Hughes County, South Dakota""]",capital of
Who was the screenwriter for Roman?,Lucky McKee,"[""Lucky McKee"", ""Edward Lucky McKee""]",screenwriter
Who is the author of Bed?,Tao Lin,"[""Tao Lin""]",author
What genre is Sripada Pinakapani?,Carnatic music,"[""Carnatic music"", ""Karnatic classical music"", ""Carnatic classical music"", ""Carnatic sangeet"", ""Karnataka sangita""]",genre
Who was the producer of Back Home?,Chuck Berry,"[""Chuck Berry"", ""Charles Edward Anderson Berry"", ""Charles Edward Anderson Chuck Berry""]",producer
Who was the director of The First Time?,Jon Kasdan,"[""Jon Kasdan"", ""Jonathan Kasdan"", ""Jonathan Peter Kasdan""]",director
What is Sydney the capital of?,New South Wales,"[""New South Wales"", ""NSW"", ""N.S.W.""]",capital of
In what country is Mac Johnson Wildlife Area?,Canada,"[""Canada"", ""Dominion of Canada"", ""British North America"", ""CAN"", ""CA"", ""Can.""]",country
In what country is Saint-Antonin?,France,"[""France"", ""fr"", ""République française"", ""La France"", ""Republic of France"", ""French Republic"", ""FRA"", ""the Hexagon""]",country
In what country is Upper Midwest forest-savanna transition?,United States of America,"[""United States of America"", ""the United States of America"", ""America"", ""U.S.A."", ""USA"", ""U.S."", ""US"", ""the US"", ""the USA"", ""US of A"", ""the United States"", ""U. S. A."", ""U. S."", ""the States"", ""the U.S."", ""'Merica"", ""U.S"", ""United States"", ""'Murica""]",country
Who was the composer of Laura?,David Raksin,"[""David Raksin""]",composer
Who was the producer of The Victim?,Jennifer Blanc,"[""Jennifer Blanc""]",producer
Who is the author of Gor?,John Norman,"[""John Norman"", ""John Frederick Lange, Jr."", ""John Frederick Lange, Jr"", ""John Lange""]",author
Who was the director of Two of Us?,Michael Lindsay-Hogg,"[""Michael Lindsay-Hogg"", ""Sir Michael Edward Lindsay-Hogg, 5th Baronet"", ""Sir Michael Edward Lindsay-Hogg, 5th Bt.""]",director
Who was the director of Irresistible?,David Nutter,"[""David Nutter""]",director
What genre is Crystal Shawanda?,country music,"[""country music"", ""country and western"", ""country & western"", ""country"", ""Nashville sound""]",genre
Who was the screenwriter for Red River Valley?,Feng Xiaoning,"[""Feng Xiaoning""]",screenwriter
Who was the screenwriter for Loop?,Tim Pears,"[""Tim Pears""]",screenwriter
What is the capital of Chittenden County?,Burlington,"[""Burlington"", ""Burlington, Vermont""]",capital
Who was the director of Legion?,Scott Stewart,"[""Scott Stewart""]",director
In what country is Jinhua railway station?,People's Republic of China,"[""People's Republic of China"", ""China"", ""CN"", ""PR China"", ""PRC"", ""CHN"", ""🇨🇳"", ""China PR"", ""Mainland China""]",country
In what country is Tocantins?,Brazil,"[""Brazil"", ""Federative Republic of Brazil"", ""BR"", ""BRA"", ""🇧🇷""]",country
Who was the director of Virus?,John Bruno,"[""John Bruno""]",director
Who was the producer of Mr. Peabody & Sherman?,Rob Minkoff,"[""Rob Minkoff"", ""Robert Minkoff"", ""Robert R. Minkoff""]",producer
Who was the director of The Host?,Daniel Sackheim,"[""Daniel Sackheim""]",director
Who was the screenwriter for Secrets?,Angela Kang,"[""Angela Kang""]",screenwriter
What is Wa the capital of?,Upper West Region,"[""Upper West Region""]",capital of
Who was the composer of Big B?,Alphons Joseph,"[""Alphons Joseph""]",composer
What genre is Sarah Cracknell?,pop music,"[""pop music"", ""pop""]",genre
In what country is Autopista AP-2?,Spain,"[""Spain"", ""España"", ""Kingdom of Spain"", ""ES"", ""ESP""]",country
Who is the father of Blue Peter?,War Admiral,"[""War Admiral""]",father
In what city was Huo Liang born?,Shanghai,"[""Shanghai"", ""Hu"", ""Shang Hai"", ""Shanghai, China""]",place of birth
What sport does Wong Pei Tty play?,badminton,"[""badminton""]",sport
What is the capital of Centre?,Ouagadougou,"[""Ouagadougou""]",capital
Who is the author of Color?,Eiki Eiki,"[""Eiki Eiki""]",author
In what country is Mahaboboka?,Madagascar,"[""Madagascar"", ""mg"", ""🇲🇬"", ""Republic of Madagascar"", ""MAD""]",country
What is Alfredo Narciso's occupation?,actor,"[""actor"", ""actress"", ""actors"", ""actresses""]",occupation
Who is the author of Yny lhyvyr hwnn?,John Prise,"[""John Prise"", ""John Price"", ""John Prys""]",author
Who was the director of No Good Deed?,Lawrence Trilling,"[""Lawrence Trilling""]",director
Who is the father of George II of Brieg?,Frederick II of Legnica,"[""Frederick II of Legnica"", ""Great of Legnica"", ""Frederick II, Duke of Legnica"", ""Friedrich II Herzog von Liegnitz""]",father
What is Giuseppe Demachi's occupation?,composer,"[""composer""]",occupation
Who was the screenwriter for Before Midnight?,Julie Delpy,"[""Julie Delpy"", ""Ethan Hawke"", ""Ethan Green Hawke""]",screenwriter
Who is the author of Love?,Toni Morrison,"[""Toni Morrison"", ""Chloe Ardelia Wofford"", ""Chloe Anthony Wofford-Morrison"", ""Chloe Anthony Wofford"", ""Morrison"", ""Chloe Anthony Wofford Morrison""]",author
Who was the screenwriter for Sneakers?,Lawrence Lasker,"[""Lawrence Lasker"", ""Lawrence Charles Lasker"", ""Phil Alden Robinson"", ""Walter F. Parkes""]",screenwriter
Who is the author of The Flea?,John Donne,"[""John Donne"", ""Very Rev. John Donne""]",author
What is the capital of Aargau?,Aarau,"[""Aarau"", ""Aarau AG""]",capital
Who was the producer of The Castle?,Maximilian Schell,"[""Maximilian Schell""]",producer
In what city was Tim Alexander born?,Chertsey,"[""Chertsey"", ""Chertsey, Surrey""]",place of birth
What is Adelaide the capital of?,South Australia,"[""South Australia"", ""SA"", ""S.A."", ""S. Aust.""]",capital of
Who was the composer of The Man with the Golden Arm?,Elmer Bernstein,"[""Elmer Bernstein""]",composer
Who was the screenwriter for This Is the End?,Seth Rogen,"[""Seth Rogen"", ""Seth Aaron Rogen""]",screenwriter
Who is the mother of Maria Alekseyevna of Russia?,Maria Miloslavskaya,"[""Maria Miloslavskaya""]",mother
In what country is Tina?,United States of America,"[""United States of America"", ""the United States of America"", ""America"", ""U.S.A."", ""USA"", ""U.S."", ""US"", ""the US"", ""the USA"", ""US of A"", ""the United States"", ""U. S. A."", ""U. S."", ""the States"", ""the U.S."", ""'Merica"", ""U.S"", ""United States"", ""'Murica""]",country
What genre is Fuel?,post-grunge,"[""post-grunge"", ""hard rock""]",genre
What color is Manchester United F.C.?,red,"[""red"", ""red color""]",color
What genre is Black Dynamite?,action film,"[""action film"", ""action movie"", ""film action"", ""movie action"", ""action"", ""blaxploitation"", ""blacksploitation""]",genre
Who was the director of The Chief?,Charles Reisner,"[""Charles Reisner""]",director
Who was the screenwriter for Mushishi?,Katsuhiro Otomo,"[""Katsuhiro Otomo"", ""Katsuhiro Ōtomo""]",screenwriter
Who was the director of Intern Academy?,Dave Thomas,"[""Dave Thomas"", ""David William Thomas""]",director
Who was the screenwriter for The Rat?,Graham Cutts,"[""Graham Cutts"", ""John Henry Graham Cutts""]",screenwriter
What genre is The Happenings?,pop music,"[""pop music"", ""pop""]",genre
Who is the father of Ma Xiu?,Ma Teng,"[""Ma Teng""]",father
What is Sala the capital of?,Sala Municipality,"[""Sala Municipality"", ""Sala kommun"", ""Sala""]",capital of
Who was the screenwriter for Camp?,Todd Graff,"[""Todd Graff""]",screenwriter
Who was the director of The Dove?,Charles Jarrott,"[""Charles Jarrott""]",director
Who was the screenwriter for The Gamble?,Carlo Vanzina,"[""Carlo Vanzina""]",screenwriter
What genre is The Nest?,horror film,"[""horror film"", ""horror movie""]",genre
Who is the author of A Good Year?,Peter Mayle,"[""Peter Mayle""]",author
What is Richard Vaughan's occupation?,bishop,"[""bishop""]",occupation
What is the capital of Bahia?,Salvador,"[""Salvador"", ""São Salvador da Bahia de Todos os Santos""]",capital
Who was the screenwriter for Staten Island?,James DeMonaco,"[""James DeMonaco""]",screenwriter
What sport does 1899 Wisconsin Badgers football team play?,American football,"[""American football"", ""gridiron football"", ""🏈"", ""football"", ""American rules football""]",sport
In what city was Belly born?,Jenin,"[""Jenin""]",place of birth
Who was the composer of Chapters?,Mejo Joseph,"[""Mejo Joseph""]",composer
Who was the producer of The Island?,Kamen Kalev,"[""Kamen Kalev""]",producer
Who is the author of Tom Sawyer Abroad?,Mark Twain,"[""Mark Twain"", ""Samuel Langhorne Clemens"", ""Samuel L. Clemens"", ""Samuel Clemens""]",author
Who was the director of The Hard Way?,John Badham,"[""John Badham"", ""John MacDonald Badham""]",director
Who was the composer of Part of Me?,Bonnie McKee,"[""Bonnie McKee"", ""Bonnie Leigh McKee"", ""Max Martin"", ""Karl Martin Sandberg"", ""Martin White"", ""Katy Perry"", ""Katheryn Elizabeth Hudson Perry"", ""Katheryn Elizabeth Hudson"", ""Katheryn Hudson"", ""Katy Hudson"", ""Katheryn Perry""]",composer
What is Lisa McRee's occupation?,journalist,"[""journalist"", ""journo"", ""journalists""]",occupation
Who was the director of Tracks?,John Curran,"[""John Curran""]",director
Who was the director of Iris and the Lieutenant?,Alf Sjöberg,"[""Alf Sjöberg""]",director
Who was the director of The Red Squirrel?,Julio Médem,"[""Julio Médem"", ""Julio Medem""]",director
Who was the director of April 18?,Balachandra Menon,"[""Balachandra Menon""]",director
Who is the author of Hollywood Arms?,Carol Burnett,"[""Carol Burnett"", ""Carol Creighton Burnett""]",author
What genre is Global?,trip hop,"[""trip hop"", ""Bristol sound"", ""trip-hop""]",genre
What is the religion of Antonio Hernández Gallegos?,Catholic Church,"[""Catholic Church"", ""Roman Catholic Church"", ""Church"", ""Roman Apostolic Catholic Church""]",religion
Who was the screenwriter for Flodder 3?,Dick Maas,"[""Dick Maas""]",screenwriter
What sport does All-Ireland Senior Club Camogie Championship 1970 play?,camogie,"[""camogie""]",sport
What is the capital of State of Vietnam?,Ho Chi Minh City,"[""Ho Chi Minh City"", ""Ho Chi Minh"", ""Sài Gòn"", ""Saïgon"", ""HCMC"", ""Sai Gon"", ""yo mum"", ""Saigon""]",capital
Who was the producer of The Interview?,Seth Rogen,"[""Seth Rogen"", ""Seth Aaron Rogen"", ""Evan Goldberg""]",producer
What is Dominick Bellizzi's occupation?,jockey,"[""jockey""]",occupation
Who was the producer of Kaaki Sattai?,Dhanush,"[""Dhanush"", ""Venkatesh Prabhu Kasthuri Raja"", ""Dhanush Kastooriraja"", ""Dhanush K Raja""]",producer
Who was the director of Time Out?,Laurent Cantet,"[""Laurent Cantet""]",director
Who was the director of El Cid?,Anthony Mann,"[""Anthony Mann""]",director
Who was the director of Blessed?,Ana Kokkinos,"[""Ana Kokkinos""]",director
Who was the producer of Housefull 2?,Sajid Nadiadwala,"[""Sajid Nadiadwala""]",producer
Who was the producer of The Easiest Way?,Clara Kimball Young,"[""Clara Kimball Young"", ""Clara Kimball"", ""Edith Matilda Clara Kimball""]",producer
What genre is Escape?,crime film,"[""crime film"", ""crime movie""]",genre
"Who was the producer of ""Them""?",King Diamond,"[""King Diamond"", ""Kim Bendix Petersen""]",producer
Who was the producer of Take It Off?,Dr. Luke,"[""Dr. Luke"", ""Made In China"", ""Richard Head"", ""Kasz"", ""Lukasz Sebastian Gottwald""]",producer
Who is the author of The Outing?,James Baldwin,"[""James Baldwin"", ""James Arthur Baldwin""]",author
What is Ye the capital of?,Northern Qi,"[""Northern Qi"", ""Bei Qi"", ""Later Zhao""]",capital of
Who was the composer of America?,Paul Simon,"[""Paul Simon"", ""Paul Frederic Simon"", ""Jerry Landis""]",composer
Who was the screenwriter for Old School?,Scot Armstrong,"[""Scot Armstrong"", ""Todd Phillips""]",screenwriter
Who is the father of Cable?,Cyclops,"[""Cyclops"", ""Scott Summers""]",father
Who was the screenwriter for United?,Chris Chibnall,"[""Chris Chibnall"", ""Christopher Antony Chibnall""]",screenwriter
What genre is Second-Hand Hearts?,comedy film,"[""comedy film"", ""comedy movie""]",genre
What genre is Real People?,reality television,"[""reality television"", ""reality TV"", ""reality television program"", ""reality TV program"", ""reality television show"", ""television reality program"", ""television reality show"", ""TV reality program"", ""TV reality show""]",genre
Who is the author of B²FH paper?,Fred Hoyle,"[""Fred Hoyle"", ""Margaret Burbidge"", ""E. Margaret Burbidge"", ""Eleanor Margaret Burbidge"", ""Eleanor Margaret Peachey"", ""Geoffrey Burbidge"", ""Geoffrey Ronald Burbidge"", ""William Alfred Fowler"", ""William Alfred \""Willy\"" Fowler"", ""William Fowler""]",author
Who was the screenwriter for The Nutcracker in 3D?,Andrei Konchalovsky,"[""Andrei Konchalovsky"", ""Andrei Sergeyevich Mikhalkov-Konchalovsky""]",screenwriter
Who is the author of World's End?,Upton Sinclair,"[""Upton Sinclair"", ""Upton Beall Sinclair"", ""Clarke Fitch"", ""Frederick Garrison"", ""Arthur Stirling"", ""Upton Sinclair Jr.""]",author
What genre is Bone Eater?,monster film,"[""monster film"", ""monster movie"", ""creature feature"", ""giant monster film"", ""Monster horror films""]",genre
Who was the screenwriter for Film?,Samuel Beckett,"[""Samuel Beckett"", ""Samuel Barclay Beckett"", ""Andrew Belis"", ""Sam Beckett"", ""Sa-miao-erh Pei-kʻo-tʻe"", ""Samuel Beḳeṭ""]",screenwriter
Who is the author of The Post Office?,Rabindranath Tagore,"[""Rabindranath Tagore"", ""Rabīndranātha Thākur"", ""Kabiguru"", ""Tagore"", ""Bishwakabi"", ""R. Tagore"", ""Rabindranat Tagor"", ""Bhanu Singha Thakur"", ""Gurudev"", ""Biswakabi"", ""Nyi Wang Gönpo"", ""Tagore, rabindranath""]",author
Who was the composer of Be Prepared?,Elton John,"[""Elton John"", ""Reg Dwight"", ""Sir Elton Hercules John"", ""Reginald Kenneth Dwight""]",composer
What is the capital of Sabah?,Kota Kinabalu,"[""Kota Kinabalu"", ""Nature Resort City"", ""Jesselton""]",capital
What sport does Tony Wagstaff play?,association football,"[""association football"", ""football"", ""soccer""]",sport
"In what country is Wilcza Jama, Sokółka County?",Poland,"[""Poland"", ""POL"", ""Republic of Poland"", ""PL"", ""Polska""]",country
